{
  "$schema": "https://json-schema.org/draft/2020-12/schema",
  "$id": "report.schema.json",
  "title": "Lyrics Eval Per-Run Report",
  "type": "object",
  "additionalProperties": false,
  "required": [
    "run_id",
    "backend_id",
    "backend_revision",
    "judge_model",
    "judge_prompt_revision",
    "fixtures_run",
    "fixtures_passed_wall",
    "aggregate",
    "per_fixture"
  ],
  "properties": {
    "run_id": {"type": "string", "pattern": "^\\d{4}-\\d{2}-\\d{2}T\\d{2}:\\d{2}:\\d{2}Z$"},
    "backend_id": {"type": "string", "minLength": 1},
    "backend_revision": {"type": "integer", "minimum": 1},
    "judge_model": {"type": "string", "minLength": 1},
    "judge_prompt_revision": {"type": "integer", "minimum": 1},
    "fixtures_run": {"type": "integer", "minimum": 1},
    "fixtures_passed_wall": {"type": "integer", "minimum": 0},
    "aggregate": {
      "type": "object",
      "additionalProperties": false,
      "required": ["mean_score", "median_score", "scores_by_category"],
      "properties": {
        "mean_score": {"type": "number", "minimum": 0.0, "maximum": 10.0},
        "median_score": {"type": "number", "minimum": 0.0, "maximum": 10.0},
        "scores_by_category": {
          "type": "object",
          "additionalProperties": {"type": "number", "minimum": 0.0, "maximum": 10.0}
        }
      }
    },
    "per_fixture": {
      "type": "array",
      "minItems": 1,
      "items": {"$ref": "judgment.schema.json"}
    }
  }
}
