{
  "run_id": "2026-05-19T08:30:00Z",
  "backend_id": "mimo-v2-omni",
  "backend_revision": 1,
  "judge_model": "claude-opus-4-7",
  "judge_prompt_revision": 1,
  "fixtures_run": 5,
  "fixtures_passed_wall": 0,
  "aggregate": {
    "mean_score": 5.2,
    "median_score": 5,
    "scores_by_category": {
      "dense_vocal": 4.0,
      "reverb_heavy": 7.0,
      "instrumental_breaks": 6.0,
      "multi_language": 4.0,
      "clean_pop": 5.0
    }
  },
  "per_fixture": [
    {
      "video_id": "5JW87KKDTcU",
      "score": 4,
      "verdict": "partial",
      "wer_estimate": 0.45,
      "line_timing_assessment": "Median absolute offset 4030ms (10x over wall threshold). Signed median +4030ms — systematic late bias, not random spread.",
      "hallucination_count": 0,
      "hallucination_details": "",
      "coverage_pct": 0.548,
      "wall_acceptable": false,
      "reasoning": "Dense_vocal fixture. MiMo-V2-Omni emitted 53 lines but timing landed 4 seconds late across the board. Coverage 55% is below Gemini (77%) and whisperx (60%). Worst dense_vocal performance among the three candidates so far. The systematic late offset suggests V2-Omni timestamps line END rather than line START, or includes a pre-roll buffer that doesn't match LRClib convention.",
      "judged_at": "2026-05-19T08:30:00Z",
      "judge_model": "claude-opus-4-7",
      "judge_prompt_revision": 1
    },
    {
      "video_id": "p74PDWAFk0A",
      "score": 7,
      "verdict": "match",
      "wer_estimate": 0.15,
      "line_timing_assessment": "Median absolute offset 780ms, signed median +410ms. Late bias but within wall-recoverable range (a single offset constant could shift it back).",
      "hallucination_count": 0,
      "hallucination_details": "",
      "coverage_pct": 0.942,
      "wall_acceptable": false,
      "reasoning": "Reverb_heavy 8-min long song. MiMo-V2-Omni matched 129 of 137 gold lines (94% coverage — best of any backend tested today) with NO hallucination clusters. Timing offset ~410ms late but consistent. This is the strongest result in the entire pilot for reverb_heavy: whisperx 61% / Gemini 53% / MiMo-V2-Omni 94%. With a -400ms global offset correction, this would be wall-acceptable. Score 7 even with current offset — text quality dominates wall_acceptable judgment on a long reverb-heavy track.",
      "judged_at": "2026-05-19T08:30:00Z",
      "judge_model": "claude-opus-4-7",
      "judge_prompt_revision": 1
    },
    {
      "video_id": "s8o2YuTBYk4",
      "score": 6,
      "verdict": "partial",
      "wer_estimate": 0.2,
      "line_timing_assessment": "Median absolute offset 970ms, signed median +870ms. Late bias, slightly larger than reverb_heavy.",
      "hallucination_count": 2,
      "hallucination_details": "Two small clusters: 'yeah' x4 at 112s and 'i'm gonna praise you with my hands raised high' x4 at 122s. The second is a real bridge repetition (whisperx + Gemini both flagged the same line); 'yeah' x4 is a likely vocalist ad-lib, less clearly hallucinatory.",
      "coverage_pct": 0.805,
      "wall_acceptable": false,
      "reasoning": "Instrumental_breaks. MiMo-V2-Omni 80% coverage — best of the three (whisperx 51%, Gemini 68%). Hallucination clusters smaller than whisperx (x8 vs x4) and similar shape to Gemini. Timing offset 870ms late. Score 6 (vs whisperx 3, Gemini 5). The candidate to beat on this category.",
      "judged_at": "2026-05-19T08:30:00Z",
      "judge_model": "claude-opus-4-7",
      "judge_prompt_revision": 1
    },
    {
      "video_id": "tCivrrU4SSM",
      "score": 4,
      "verdict": "partial",
      "wer_estimate": 0.4,
      "line_timing_assessment": "Median absolute offset 3350ms, signed median +3350ms. 3.3 seconds late, similar to but slightly worse than Gemini (1.2s late).",
      "hallucination_count": 0,
      "hallucination_details": "",
      "coverage_pct": 0.638,
      "wall_acceptable": false,
      "reasoning": "Multi_language. MiMo-V2-Omni coverage 64% — below Gemini (77%) but above whisperx (43%). 3.3 second late offset is unusable on the wall directly. Score 4, same as Gemini. The 'multi_language' category needs more attention — all three backends have systematic timing drift suggesting a structural issue (perhaps the gold annotations or pre-vocal intro).",
      "judged_at": "2026-05-19T08:30:00Z",
      "judge_model": "claude-opus-4-7",
      "judge_prompt_revision": 1
    },
    {
      "video_id": "YbGFYaA0SbY",
      "score": 5,
      "verdict": "partial",
      "wer_estimate": 0.18,
      "line_timing_assessment": "Median absolute offset 3130ms, signed median +3130ms. 3.1 seconds late — worst clean_pop timing of the three.",
      "hallucination_count": 0,
      "hallucination_details": "",
      "coverage_pct": 0.926,
      "wall_acceptable": false,
      "reasoning": "Clean_pop. MiMo-V2-Omni 93% coverage (vs whisperx 85%, Gemini 70%) — best text recall. But 3-second late timing destroys wall_acceptable. Whisperx's strong category (it was the only fixture in the entire pilot that crossed the wall gate, scoring 7). MiMo-V2-Omni's coverage edge would push it above whisperx if the timing offset were corrected — under current timing, scores 5 vs whisperx's 7.",
      "judged_at": "2026-05-19T08:30:00Z",
      "judge_model": "claude-opus-4-7",
      "judge_prompt_revision": 1
    }
  ]
}
