{
  "run_id": "2026-05-19T13:00:00Z",
  "backend_id": "assemblyai-universal-3-pro",
  "backend_revision": 1,
  "judge_model": "claude-opus-4-7",
  "judge_prompt_revision": 1,
  "fixtures_run": 5,
  "fixtures_passed_wall": 4,
  "aggregate": {
    "mean_score": 6.6,
    "median_score": 7,
    "scores_by_category": {
      "dense_vocal": 6.0,
      "reverb_heavy": 5.0,
      "instrumental_breaks": 7.0,
      "multi_language": 8.0,
      "clean_pop": 7.0
    }
  },
  "per_fixture": [
    {
      "video_id": "5JW87KKDTcU",
      "score": 6,
      "verdict": "partial",
      "wer_estimate": 0.4,
      "line_timing_assessment": "Median absolute offset 145ms, signed median +5ms — best timing of any backend tested on this fixture. Sub-150ms is karaoke-grade.",
      "hallucination_count": 0,
      "hallucination_details": "",
      "coverage_pct": 0.371,
      "wall_acceptable": true,
      "reasoning": "Dense_vocal fixture. AAI Universal-3 Pro emitted 309 correctly-aligned words grouped into 29 lines (gold has 62 lines). Coverage 37% because the 800ms silence-gap line-splitter merges adjacent gold lines into single AAI lines — a line-grouping problem, not a transcription problem. Timing is the cleanest of any backend tested today (median +5ms vs gold). With a tighter line-splitter (~400ms gap) coverage should roughly double. Score 6 because timing passes the wall gate but missing 60% of gold line boundaries; not yet wall-acceptable as a finished product, but the underlying signal is right.",
      "judged_at": "2026-05-19T13:00:00Z",
      "judge_model": "claude-opus-4-7",
      "judge_prompt_revision": 1
    },
    {
      "video_id": "p74PDWAFk0A",
      "score": 5,
      "verdict": "partial",
      "wer_estimate": 0.45,
      "line_timing_assessment": "Median absolute offset 721ms — over the 400ms wall threshold. Signed median +319ms (under threshold) — the absolute-median is inflated by a few outlier matches. 8-minute reverb-heavy live recording stresses any acoustic aligner.",
      "hallucination_count": 0,
      "hallucination_details": "",
      "coverage_pct": 0.401,
      "wall_acceptable": false,
      "reasoning": "Reverb_heavy 8-min fixture. AAI produced 723 words / 75 lines. Coverage 40% same line-splitter issue as song 1; signed median timing +319ms is wall-acceptable but median_abs 721ms shows scatter from outlier matches. The reverb in the original recording is the dominant difficulty here — every backend struggles, AAI not exempt. Score 5 — timing within range, scatter concerning, coverage low.",
      "judged_at": "2026-05-19T13:00:00Z",
      "judge_model": "claude-opus-4-7",
      "judge_prompt_revision": 1
    },
    {
      "video_id": "s8o2YuTBYk4",
      "score": 7,
      "verdict": "match",
      "wer_estimate": 0.25,
      "line_timing_assessment": "Median absolute offset 188ms, signed median -29ms — essentially zero drift. Scored against re-anchored gold (+473ms shift).",
      "hallucination_count": 0,
      "hallucination_details": "",
      "coverage_pct": 0.61,
      "wall_acceptable": true,
      "reasoning": "Instrumental_breaks fixture. Coverage 61% (much higher than the dense_vocal fixture's 37% — fewer gold line splits to mis-merge). NO hallucination clusters, in stark contrast to whisperx (1 cluster x8) and Gemini (1 cluster x8 on the same song). Timing essentially perfect (~30ms drift). Score 7 — first wall-acceptable AAI result, and meaningfully better than whisperx (3) and Gemini (5) on this category. Line-splitter tune would push coverage higher.",
      "judged_at": "2026-05-19T13:00:00Z",
      "judge_model": "claude-opus-4-7",
      "judge_prompt_revision": 1
    },
    {
      "video_id": "tCivrrU4SSM",
      "score": 8,
      "verdict": "match",
      "wer_estimate": 0.2,
      "line_timing_assessment": "Median absolute offset 203ms, signed median +118ms — well inside wall tolerance. Scored against re-anchored gold (+1137ms shift); the pre-shift gold was wrong, AAI's timing was correct all along.",
      "hallucination_count": 0,
      "hallucination_details": "",
      "coverage_pct": 0.702,
      "wall_acceptable": true,
      "reasoning": "Multi_language fixture. Coverage 70% — the strongest coverage AAI showed across the pilot, on the very category whisperx scored 3 on and Gemini scored 4. Timing within 200ms median. Score 8 — first clean win on the toughest category in the entire eval. Note: this fixture's gold was re-anchored after multi-backend consensus showed LRClib was 1.1s early; the +118ms AAI offset is against the CORRECTED gold. AAI was the only backend whose original timing was already close to truth on this song.",
      "judged_at": "2026-05-19T13:00:00Z",
      "judge_model": "claude-opus-4-7",
      "judge_prompt_revision": 1
    },
    {
      "video_id": "YbGFYaA0SbY",
      "score": 7,
      "verdict": "match",
      "wer_estimate": 0.25,
      "line_timing_assessment": "Median absolute offset 144ms, signed median -119ms — well inside wall tolerance. Re-anchored gold (+275ms shift).",
      "hallucination_count": 0,
      "hallucination_details": "",
      "coverage_pct": 0.63,
      "wall_acceptable": true,
      "reasoning": "Clean_pop fixture (whisperx's strong category at score 7). AAI Universal-3 Pro scores 7 here as well — timing better, coverage lower (63% vs whisperx 85%, both against re-anchored gold). The lower coverage is again the line-splitter problem; ground-truth-acceptable timing is in place.",
      "judged_at": "2026-05-19T13:00:00Z",
      "judge_model": "claude-opus-4-7",
      "judge_prompt_revision": 1
    }
  ]
}
